{
  "id": "tier-default-off",
  "plugin": "frontend-angular",
  "claim": "plugin-meta.json recommends default-off tier.",
  "activation": "unknown",
  "target": {
    "file": "plugin-meta.json",
    "section": "full"
  },
  "assert": {
    "type": "regex",
    "pattern": "\"tier\"\\s*:\\s*\"default-off\""
  }
}
