{
  "id": "skill-use-when",
  "plugin": "jira-workflow",
  "claim": "jira-triage skill description includes Use when trigger for Jira workflow.",
  "activation": "unknown",
  "target": {
    "file": "skills/jira-triage/SKILL.md",
    "section": "frontmatter"
  },
  "assert": {
    "type": "contains",
    "value": "Use when",
    "ignoreCase": true
  }
}
