{
  "id": "command-model-router-present",
  "plugin": "cost-efficiency",
  "claim": "model-router command exists with name frontmatter.",
  "activation": "unknown",
  "target": {
    "file": "commands/model-router.md",
    "section": "frontmatter"
  },
  "assert": {
    "type": "regex",
    "pattern": "name:\\s*model-router"
  }
}
