{
  "id": "telemetry-review-use-when",
  "plugin": "obs-telemetry",
  "claim": "telemetry-review-use-when content check.",
  "activation": "unknown",
  "target": {
    "file": "skills/telemetry-review/SKILL.md",
    "section": "frontmatter"
  },
  "assert": {
    "type": "contains",
    "value": "Use when",
    "ignoreCase": true
  }
}
