{
  "id": "skill-use-when",
  "plugin": "cloud-azure",
  "claim": "azure-review skill description includes Use when trigger.",
  "activation": "unknown",
  "target": {
    "file": "skills/azure-review/SKILL.md",
    "section": "frontmatter"
  },
  "assert": {
    "type": "contains",
    "value": "Use when",
    "ignoreCase": true
  }
}
