{
  "id": "architecture-intake-use-when",
  "plugin": "engineering-playbooks",
  "claim": "architecture-intake skill description includes Use when trigger.",
  "activation": "unknown",
  "target": {
    "file": "skills/architecture-intake/SKILL.md",
    "section": "frontmatter"
  },
  "assert": {
    "type": "contains",
    "value": "Use when",
    "ignoreCase": true
  }
}
